Date,Name,Year,Letterboxd URI,Rating,Rewatch,Review,Tags,Watched Date
2022-09-02,American Psycho II: All American Girl,2002,https://boxd.it/3bHGsF,1.5,,"This takes American Psycho's unreliable narrator bit and biting criticism of the well moneyed and kinda craps all over it.  However, if you were to ignore the title and the Patrick Bateman tie in and just treat it on it's own, it's still kinda junk but it's not terrible.

Do you want to see a homicidal crazy person craze about? Then this is the movie for you.",,2022-09-02
2022-09-03,The 4th Floor,1999,https://boxd.it/3bPovR,2.5,,"If this is what apartment living in NYC is like, I'll pass. This poor lady gets gaslit and just talked down to the whole movie. Like everyone craps on her. And then I consider how she thinks pounding nails and dropping giant stones on the floor late at night is cool and then I think maybe the crazy killer has a point.",,2022-09-03
2022-09-06,Alien Intruder,1993,https://boxd.it/3cuTZb,1.5,,"I'm sure there was a huge disparity in budget but I find it so crazy that this movie came out 4 years before Event Horizon. It's a bit of a similar premise to me, but instead of disturbing visions of having no eyes and driving people to maim and kill themselves because the ship is from hell there are a bunch of misfit convicts that are given a weekend in a sexy-time holdodeck that is twisted by an alien presence. Then on the mission in deep space the alien (a good looking lady from an 80s TV show?) drives the crew jelly with her hotness. Or something. Madness ensues.

It's kind of a mess, I'm sorry Mr. Williams. There are a lot of topless women to try and make up for the serious lack of budget in the film, but it didn't work. I would give it straight up 1/2 a star but I want to give them credit for being realistic in portraying what a holodeck would be used for in space.",,2022-09-06
2022-09-06,Apollo 18,2011,https://boxd.it/3cxCI9,2.5,,"I've seen it before. I can't quite put my finger on it, but I don't find it creepy or as anxiety inducing as some of the other ones I've seen. I can't tell if I'm growing weary of found footage films or if there was something about the script that made this one just kind of flat.

Still, it's quite short and it got a couple of jump scares on me. So it's not total garbage.",,2022-09-06
2022-09-07,Apache Woman,1976,https://boxd.it/3cBMDB,1,,"It's like an exploitative Dances with Wolves. So imagine all the problems with Dances with Wolves, crank up the racism from medium to extra KKK and throw in constant rape.  Everyone in this movie is threatening to kill or rape everyone else in this movie as like a greeting.

I give it a little extra points for showing a rougher side of the west than you normally get in spaghetti era westerns. But this isn't great. Don't watch it.",,2022-09-07
2022-09-08,Anaconda,1997,https://boxd.it/3cSSpJ,1.5,,"This is a movie about a giant asshat that stole a boat and chases a giant snake. When shit goes down, the crew he has pressed into service don't think about throwing him overboard. This movie has really horrible dated CGI.",,2022-09-08
2022-09-12,The Rock,1996,https://boxd.it/3dFZcb,3.5,,"There's a whole bunch of this movie where people are yelling at each other to stand down. It's a good movie, I think the motives of the general seem a little iffy.

Dude asked for a hundred million dollars. I hope to god if this much is on the line the government would just cough it up.",,2022-09-12
2022-09-14,Prime Evil,1988,https://boxd.it/3dZN9f,2.5,,"This was a weird joint. There is big devil worshipping going on, trading your kids for like 13 years extra life and other wild shit. I gotta say, I literally just watched this and the details have fallen out of my brain. There were lots of topless women, a priest that was trying hard to get your girl in bed and some nun who was out to fight for jesus.

I think in the last like two minutes the devil got stabbed by the nun or maybe some dude was secretly the devil and got stabbed by the nun? FX budget constraints made it hard to tell.

It was sleazy, the priest had some hard 'I'm going to have you anyway I want' vibes going on and there was a badly acted nun fighting for god. I'll give it meh as a rating.",,2022-09-14
2022-09-15,Pumpkinhead,1988,https://boxd.it/3e8u4N,3,,"This reminds me of a few different films but really it's like a telling of a legend or of a mythical creature. I really like the atmosphere and shots around that but the creature itself is a little too rubber suit for my tastes. Other than that, if you like some old school folklore or ghost stories, this is a good one.",,2022-09-15
2022-09-15,Real Genius,1985,https://boxd.it/3e8Ihh,4.5,,This movie is why I went to college. It is remarkable how well it aged.,,2022-09-15
2022-10-10,The Last Starfighter,1984,https://boxd.it/3jdVcf,3,,"The graphics probably took all the budget and then some at the time. They look like something from OG playstation. If you look carefully during the game.playing sequences you can see the same 3 seconds repeatedly.

But that aside, this is a fun sci Fi adventure that I think hit my tween self just right. Watched it again and it was still pretty fun.",,2022-10-10
2022-10-16,Scream,2022,https://boxd.it/3kk7I9,3,,intergenerational warfare masquerades as slasher,,2022-10-16
2022-10-16,Firestarter,2022,https://boxd.it/3kk8j5,1.5,,"loosely based on prodigy song

also

didn't dude kill your mom?",,2022-10-16
2022-10-16,Collateral,2004,https://boxd.it/3kk8L9,3,,La Crime with self empowerment,,2022-10-16
2022-10-16,L.A. Confidential,1997,https://boxd.it/3kk8ZF,5,,top notch sleezy crime drama,,2022-10-16
2022-10-25,The Town that Dreaded Sundown,2014,https://boxd.it/3mpiKD,3,,"I kinda liked this one, but not enough to ever see it again. The killing is brutal and violent, the reasoning behind it seems especially weak. I've never seen the original, I really like the stylistic choices they made for this reboot.",,2022-10-24
2022-10-26,Se7en,1995,https://boxd.it/3mBelD,5,,"--- Smashes the door open
""Well, no point in arguing anymore unless you can fix that.....And this""

Other than the lighting in some places, I can't think of a better thriller. Silence of the Lambs comes very close to this, but the downer of an ending that was so in vogue for the 90s is a cherry on top for this one.

Profane and disturbing film. A must see.",,2022-10-26
2022-11-21,Futureworld,1976,https://boxd.it/3s16Qb,1.5,,"This is a super dull movie which is why I think so many people are complaining about having watched it and forgotten about it. Two reporters are assigned to look at the recovery of the resort that had robots creating fantasy worlds and the robots murdered everyone. Turns out the public is into getting murdered cause everyone is coming back to this place because the robots have a new and improved formula.

There's an interesting twist at the end that is kinda buried under a silly chase scene. However, I think since this is in the westworld universe and the show has a lot to talk about robots as people, it's probably part of the ideas that generated the show. It's not enough of a fun twist to revisit or keep around imo, so to the bin it goes. It's just too boring.",deleted,2022-11-21
2022-11-25,Baba Yaga,1973,https://boxd.it/3sSoG5,2,,"Like a lot of Italian films from this time period, this is pretty to look at. It's a super odd film though, and it's really hard to know what's happening in the story and what's being imagined by the protagonist. Costumes are pretty wild, and there is an awful lot of topless women running around like bosses.",,2022-11-25
2022-11-25,The Werewolf Versus the Vampire Woman,1971,https://boxd.it/3sSCEH,,,"I can't rate this, I didn't have sub-titles and my spanish isn't good enough to keep up. Although, I mean it is a monster v monster movie maybe I should have gave it more of a chance.",,2022-11-25
2022-11-25,Island of Death,1976,https://boxd.it/3sSTml,1.5,,"Dude's kink is banging his wife in a phone booth while his mom listens. Like I don't know what else is going on in this movie, but damn.

Follows up with judging a bunch of people around him, watches someone have sex and judges them, then goes and murders a goat when his wife says she's too tired.

I was expecting this movie to be kind of shitty to watch but this dude is making it awful in ways I wasn't expecting.

You know this movie was a whole lot stranger when I thought it was 1976's Who Can Kill a Child? (Thanks plex)",,2022-11-25
2022-11-25,The Fatal Glass of Beer,1933,https://boxd.it/3sVRxH,1,,"This was a short movie about some guy who left the farm returning. Except the farm seems to be out in the Klondike and there's this running gag where the old man keeps getting snow thrown in his face when he looks out the door.

This is like an episode of hee-haw, that level of humor.",,2022-11-25
2022-11-25,The Birth of a Nation,1915,https://boxd.it/3sWqTN,0.5,,"I really didn't care for City Lights, but I could respect some of the things that they were trying for. This was an incredibly long and boring movie. If you want to watch someone tell you about the lost cause, I'd watch 'Gone with the Wind', at least I can understand what the hell is going on. 

I get it that this is an early film, just a few years after the famous movie about going to the moon and it's crazy advanced for that. But look, this is three hours of your life. Do you really want to waste it on lingering shots over plates of corn. Multiple times? Or watch people from a hundred years ago get their black face on? Screw that. Sorry your dad filled your head with BS ideas of the pleasantness of enslaving people but sweet lord this is painful.",,2022-11-25
2022-11-26,This Is the End,2013,https://boxd.it/3t6xyH,2,,"The first act is funny enough but then it outstays it's welcome. I did enjoy Emma Watson robbing everyone, that was pretty good.

Almost like it is apocalypse themed sketch comedy. Some of it lands. But I'm removing it from the collection.",,2022-11-26
2022-11-27,The Amazing Mr. X,1948,https://boxd.it/3tok3d,3,,"With such a short running time, to me it dragged in the beginning setting up this melancholy mood but after a bit it got pretty good. It's a story of a medium that gets involved over his head with a widow. There's some interesting character development and I liked how it showed the medium's bag of tricks in some ways. Decent movie, could get a rework for today and it wouldn't be off at all.",,
2022-11-27,Rawhead Rex,1986,https://boxd.it/3tq3b9,2.5,,"This is a decent story with some really bad effects. It makes it hard to suspend some disbelief. Also, they don't shy away from the fact that it looks like rubber, and it's in a lot of shots. Unlike Jaws, they didn't have the sense to let the story do the showing.

Anyways, I had to delete it. But I'm glad I saw this rubber man rampage through a Irish trailer park.",,
2022-11-29,Doppelganger,1993,https://boxd.it/3tQ7rR,2.5,,"This is a mash up of single white female with some basic instinct topped with like raising cain or something.

Lady with multiple personalities is pretty aware of it and is trying to just push past it by treating it like it's not a big deal. There's a body count but she's just like ""Wasn't me dude"" and then thinks that will keep her free. There is some real LA writer back and forth like when there's not Drew Barrymore blatantly killing people or having sex or bathing in blood for some reason.

I give it a decent amount of stars because that was some crazy nonsense. But look, I am not keeping this around on my hard drive, sorry. ",,
2022-11-30,Visiting Hours,1982,https://boxd.it/3u2UFd,2,,"Michael Ironsides is exudes violence and really does well with the role of a violent killer. But other than being from an abusive home and having a problem with people because of that, I really don't understand the motivations here at all. Also, the story kind of flits about focusing on different people that are (to me at least) randomly targeted to be murdered. I didn't think that Captain Kirk chewed on too much scenery. 

It's too incoherent to keep, so into the bin it goes.",,
2022-12-02,Sometimes They Come Back,1991,https://boxd.it/3uiqn1,1.5,,"Took the teeth out of the short story and turned it into a sappy ghost story. No demon bargain, which was to me the interesting twist for the story in the first place. Hallmark channel horror.",,
2022-12-02,Cool World,1992,https://boxd.it/3ukBfB,1.5,,"Heavy Metal + Who Frame Roger Rabbit + The Mask

IDK, this isn't a movie you have to see. It's got some madcap cartoons in the background but the soundtrack is miles better than the movie. I can't believe the talented people sleazing it up in this movie.",,
2022-12-02,Vampirella,1996,https://boxd.it/3uobTj,0.5,,"This is just awful. Space vampires land on Earth and start some trouble. Evidently there's already vampires and some Van Helsing org fighting them on Earth so it gets pretty crazy fast. Also, there is a bikini wearing lady that is out for vengeance. 

This movie has a lot going on.",,
2022-12-02,Strangeland,1998,https://boxd.it/3up3Pv,2.5,,"This is super grounded in the 90s, but it's kind of interesting the story they are telling here. It's not just a straight torture porn kind of thing. There's some stuff here about how people can't forgive and forget, mob violence and how some people are seeking something bigger than themselves.

It's ham-fisted writing and I think Snider isn't creepy enough to carry this I don't think. It reminds me too much of the Saw guy.",,
2022-12-02,Species,1995,https://boxd.it/3uph8P,3.5,,It's pretty horny sci-fi but I think it's also kinda terrifying body horror. Your results may vary.,,
2022-12-03,Species II,1998,https://boxd.it/3usKUp,2,,"This one ramped up on the gore and nudity and didn't even try to have a story. It's a monster movie, and the monster in this case is an astronaut that cause women to explode with a child seconds after he screws them. There is a very poorly lit fight scene between two monsters in the end and some very dubious science magic so humanity can win in the end.

It's got a good budget so it doesn't look like crap, and I like the leads well enough so the acting isn't crap. But the story is, so it gets only 2 stars and a place in the bit bucket of my hard drive.",,
2022-12-03,Vampires,1998,https://boxd.it/3ut4yj,1.5,,"I think that's twitter asshole James Woods acting like he's a commando. This is a renegade cop movie but instead of cops it's the Catholic Church. Or maybe like a suicide squad or something.

But seriously the asshole that James Wood is in this movie? I think that's just him being him. 

DELETED",,
2022-12-03,The Haunting,1999,https://boxd.it/3uv5j9,2.5,,"I saw this in the theater, it had a couple of good moments in it and the creepiness and atmosphere came through. In the end it feels really low stakes though and the CGI makes it a hard watch now.

Premise is psychologist gathers some people together in a spooky house to experiment on them. The house is haunted though, and haunted stuff starts happening with different people believing different sources of the shenanigans. The ending is a bit soft, I think they were going for bittersweet. No one in the show really feels cast right.",,
2022-12-03,Idle Hands,1999,https://boxd.it/3uw2BB,1,,"Silly ass burner movie. Half-baked already has my heart in this category, this hit me stupid as hell.",,
2022-12-04,We Need to Talk About Kevin,2011,https://boxd.it/3uGsNN,3.5,,"As a parent, this movie is terrifying.",,
2022-12-05,The Gingerbread Man,1998,https://boxd.it/3v6Ctb,2,,"This is a little slow but this is why you don't help out people. They are just trying to get you involved in some intricate plot, if you're lucky all you'll end up doing is killing their dad.",,
2022-12-07,Abduction 101,2019,https://boxd.it/3vutyf,1.5,,"This seems to be someone's kink and I just don't get it. But the lingering shots when the women touch each other like couples do and the clubbing of the women like they were baby seals is just odd. The narration has an odd cadence and the tense seems off several times. This thing comes across as a no-budget cthulu horror story, but it ends up it's just a dream or something. There seems to be some kind of fight club-esque point about the retelling of the dream, but it's pretty weak to me.

I kind of liked the bits where the lady with the axe was running around handling people and it was fine right up until the retelling ended.  So I give it a little love for that.",deleted,
2022-12-08,The Old Dark House,1932,https://boxd.it/3vG2d9,2,,"This is a bunch of craziness. Like 3 sets of people turn up at this old house because of a storm. Instead of just going to their rooms and sleeping until the morning, they decide to party like it's a house party. 

They should have just gone to bed and locked their doors.",,
2022-12-08,Waxwork,1988,https://boxd.it/3vGzDz,1.5,,"This starts out really tame and doesn't do much after that. If you act like a jackass at a museum you die? Wax statues come to life and kill, living out the scene they are staged in. This is really weird, and not in a way that I enjoyed.

Then they got Jenkins! I mean, shit, is nothing sacred.",,
2022-12-10,711 Ocean Drive,1950,https://boxd.it/3vZwFv,2,,"That was kind of slow.

An electrician gets tagged to help out the mob, and then he gets delusions of grandeur and acts them out. There is a rise and fall in organized crime that is pretty ""eh, a wise guy eh?"" kind of shenanigans and that's just not my jam. I kinda thought the ways to cheat at horse races was fun and there is also a tour of hoover dam.

Can't think of why I'd ever want to see this again, so DELETED",,
2022-12-21,A Bay of Blood,1971,https://boxd.it/3yAkJR,3,,"I had never heard of this movie before. It's all 70s style but it's a crazy slasher film. Nudity and fairly violent kills. You remember that crazy spearing in Friday the 13th part 3? I do and evidently this movie had it first. Also you get to watch a guy take a machete to the face out of nowhere. The premise is hard for me to understand exactly, but it's like a Miss Marple movie with boobs and serious violence. And no Miss Marple.

Also the last like twenty minutes are a crazy series of flashbacks culminating in nonsense. Beautiful beautiful nonsense.",,2022-12-20
2022-12-21,Bedazzled,2000,https://boxd.it/3yBULB,1.5,,"Did you ever wonder if Brendan Fraser was the kind of actor that should be in a sketch comedy show playing random people in a series of small skits showing how the devil could be tricky? Movie executives did. This is not a good movie though. Shame though, since I grew up in the 80s I would also sell my soul to Elizabeth Hurley. She had me at ""What would you little maniacs like to do first"". And I have to imagine this didn't help anyone's career.",,2022-12-20
2022-12-21,Bad Dreams,1988,https://boxd.it/3yKCEF,2.5,,"I found this a bit boring, it's like a mystery movie with a very unreliable narrator. The subject matter is interesting enough and I was concerned for the people involved until towards the end I thought it was a little (pardon the expression) nuts. Just unbelievable.

Anyways, it didn't punch me in the mouth so I'm deleting it. At least it wasn't like girl, interrupted. ",,2022-12-21
2022-12-23,A Christmas Story,1983,https://boxd.it/3zh4z3,5,,"This movie hits a lot of feels, I love it.",,2022-12-22
2022-12-25,The Grinch,2018,https://boxd.it/3zJCAZ,3,,"It's how the Grinch stole Christmas, it's not going to be some kind of epic poem. I enjoyed the side story of the girl who wants to ask Santa for something and goes to increasingly desperate measures to ensure the message is relayed. It is less offensive to my eyeballs than the Jim Carrey version so there's that.",,2022-12-24
2022-12-25,Barbarian Queen,1985,https://boxd.it/3zRVGt,2.5,,"At first I thought this was going to be a D&D version of I spit on your grave or something, but when they failed to refrigerator the hunky fiance I lost hope. It did end up feeling like it was written by that guy in your 8th grade D&D circle that was trying to pick up tavern wenches while the rest of us were trying to play the fricking game. I give it some points for the titular queen using some kind of kegel death grip to kill her assaulter, that was really out of nowhere. I guess she rolled a 20 on her saving throw.

There is a ton of men torturing women and raping going on, and it was close to being this crazy revenge flick but about midway through it got less woman on a mission to kill her assaulters and more about some kind of rando medieval times political adventure. The movie should of offed the boyfriend and then the queen just murders folks that were involved. That would have been a way better movie.",,2022-12-24
2022-12-25,Basic,2003,https://boxd.it/3zTSSl,1.5,,"John Travolta is too smug for me to enjoy in a movie. Double, triple twist ending ahead and by the end of it I could not give less of a crap.

DELETED",,2022-12-24
2022-12-25,The Contractor,2022,https://boxd.it/3zU1X5,3,,I was on a plane so I am giving this maybe more credit than it deserves. I really appreciated the dude figuring out what exactly he's gotten involved in but the last act made it slip from something pretty good to something just ok.,,2022-10-09
2022-12-26,Hatchet,2006,https://boxd.it/3AcfHh,2.5,,I was expecting this to be a whole lot worse. It's really really gory for the silly mood that is set in the opening act. Lots of boobs (it is set in New Orleans Mardi Gras) and then lots of killing.,,2022-12-25
2022-12-26,Hatchet II,2010,https://boxd.it/3AcpdB,1.5,,"This wasn't as slick as the first one, which is understandable as the survivor from the first one immediately goes back for more. It's a dumb premise and everyone has really dubious motives. The jokes aren't as good in this one either.",,2022-12-25
2022-12-26,Haunted Honeymoon,1986,https://boxd.it/3AcDHv,1.5,,"This is a weird movie that isn't very funny to me. 

You want a movie about eccentric rich people in a big house watch Ready or Not.",,2022-12-25
2022-12-26,Hatchet III,2013,https://boxd.it/3Af4CL,1.5,,"I was reminded of the AHS where there was a haunted mansion where people were straight up murdered by ghosts repeatedly on camera. By this point in the series, things have escalated quite a lot. It's just a gore fest, none of the comedy is left, it's just murder porn.",,2022-12-25
2022-12-26,The Haunting of Morella,1990,https://boxd.it/3AhR0b,1.5,,"I had no idea Poe was so horny. This does have a bit of a melancholy set up where a lady gets caught sacrificing the staff to the devil so the town murders her (and blinds her, which seems to be just some gratuitous oddity it doesn't come up again)

Fast forward 17 years and the widowed husband is blind and all sad sitting around and everyone in the house is up to more witchcraft and bathing with their girlfriends.  There is a plot to bring back the witch from the dead and/or put her spirit into the daughter. Or something. And boobs.",,2022-12-25
2022-12-26,Hitcher in the Dark,1989,https://boxd.it/3AjEDN,1.5,,This is a strange movie. A dude driven to psychotic rage because his mom left him with his rich dad. If it wasn't for a fair amount of nudity in the middle of the film I would I have thought of this as Hallmark does Silence of the Lambs.,,2022-12-25
2022-12-26,House,1985,https://boxd.it/3AkwSH,1.5,,"There are some cool effects in here, but it's not a great movie. ",,2022-12-26
2022-12-27,House on Haunted Hill,1999,https://boxd.it/3AtNzb,2.5,,This feels like a shittier version of Event Horizon. I really enjoyed the Prices' witty banter but the rest of the movie falls quite a bit flat for me.,,2022-12-26
2022-12-27,Human Experiments,1979,https://boxd.it/3Aw1u9,0.5,,This isn't fun or interesting. It's just sad and lame. Women's prison exploitation movie without much exploitation. Banality of evil I guess.,,2022-12-26
2022-12-27,I Still Know What You Did Last Summer,1998,https://boxd.it/3ADqWr,1.5,,"I know studios like money, but this is a shit movie. It is terrible top to bottom. Y'all should be ashamed of yourselves, cause I know you aren't poor.",,2022-12-26
2022-12-27,Immortal Sins,1991,https://boxd.it/3AGdLV,1.5,,Couldn't really finish it. It had some decent atmosphere but it was pretty slow burning and I've seen this kind of thing before so I checked out.,,2022-12-26
2022-12-27,Impact,1949,https://boxd.it/3AHjcp,2,,"that dude needed to get his wife charged with conspiracy to commit murder immediately. This was like doc holllywood, but instead of a broke down car it's attempted murder.",,2022-12-26
2022-12-28,Invaders from Mars,1986,https://boxd.it/3AQ5m9,1,,"I would like to think even my tween self would recognize this as derivative junk. I feel bad saying this too, someone had to make massive puppets and practical effects for some of this stuff.

Invasion of the martian body snatchers, but a kid brings in the marines to fight back.  DELETED",,2022-12-27
2022-12-28,Invisible Agent,1942,https://boxd.it/3AQQdN,1.5,,"This is propaganda for a war that has very few living combatants left. I don't think I need to watch past the first few minutes to know what's up.

The effects are notable, but the script and acting and such doesn't seem very interesting to me. Some casual racism thrown in because it was the 40s.

Stick with the original or better yet, the 2020 invisible man is good.",,2022-12-27
