Date,Name,Year,Letterboxd URI,Rating,Rewatch,Review,Tags,Watched Date
2023-07-04,The Hunt,2020,https://boxd.it/4t2vmJ,3,,"This hit me up front as some kind of MAGA revenge fantasy and then it seemed to be trying to have a woman that hates both extremes but really she lets the Q Anon folks off as harmless dullards and murders all those liberal elites. 

Anyways, nah. I don't need to see this again. I get it.",,2023-07-03
2023-07-05,Armageddon,1998,https://boxd.it/4tdhxv,3,,"Physics be damned, let's make a space movie. This is pretty fun to watch and I always like watching Bruce Willis doing his Everyman schtick.  It's a hell of a lot more fun than deep impact.",,2023-07-04
2023-07-09,Prey,2022,https://boxd.it/4ufjCZ,3.5,,I feel like Predator should have been one and done. The pacing for this movie made me think of the repeating out of the frying pan into the fire of Apocalyptico. The predator seems to be murder more than taking trophies. My mediocre response to this one comes from the kill porn tone of the movie. I really liked the lead and it's visually appealing.,,2023-07-08
2023-07-10,Interstellar,2014,https://boxd.it/4uBVix,3,,"This is slow paced, and the ending is pretty convoluted for me. I like the harrows of space travel and relativity. 

I'll keep it though, it might grow on me",,2023-07-09
2023-07-10,Nine to Five,1980,https://boxd.it/4uQLO9,3.5,,"Pretty team by today's standards, still resonates in a lot of ways. I can't imagine meeting somebody that still acts like this in today's times but slimy behavior just hides under a veneer I guess.",,2023-07-09
2023-07-11,Three Thousand Years of Longing,2022,https://boxd.it/4uVz0h,2.5,,A lot of talking between two people as voice overs for some beautiful scenes of extremes of human emotion. Kinda felt like a play. Exploration of human condition?,,2023-07-10
2023-07-11,Orphan: First Kill,2022,https://boxd.it/4v875f,4,,That really jumped.up.a notch. I mean that escalated.,,2023-07-10
2023-07-11,American Sniper,2014,https://boxd.it/4v9zff,2.5,,All the stars I give are for the combat portrayal and showing how in the modern era you never really leave the war behind and it gets up close to your family.,,2023-07-10
2023-07-14,Hard Ticket to Hawaii,1987,https://boxd.it/4vQiSb,3,,"Alright, it was pretty entertaining. It is a ludicrous Miami Vice episode with a budget that says the crew wanted to really go to Hawaii for a while. Everything about this is bad in a way that is pretty fun and if you can roll with that, this is probably a movie for you.",Spielenwald,2022-07-16
2023-07-16,Captain Underpants: The First Epic Movie,2017,https://boxd.it/4wsshb,3,,"I have lots of kids, so I am (unfortunately) well versed in the adventures of Captain Underpants. This is a very faithful adaptation of the first book.",netflix,2023-07-15
2023-07-16,The Cabin in the Woods,2011,https://boxd.it/4wxgUP,4,,Watching it the first time this is 5 stars. Repeated watching is less fun. I still love the hell out of this movie. Gives reasons for all the silly tropes in horror movies. Has so many people you know too. Thors in it!,,2023-07-15
2023-07-16,Traffic,2000,https://boxd.it/4wBF7V,3.5,,"There are a couple of times the exposition gets a little out of hand, but I think it does an alright job portraying interlinked dramas centered around cocaine. It feels a little too slick in some areas but yeah, this is alright.",netflix,2023-07-15
2023-07-16,Circle,2015,https://boxd.it/4wBHax,3,,"It's low budget people standing in a room, but I was entertained. It was like a really good twilight zone episode or something.",,2023-07-15
2023-07-17,The Meg,2018,https://boxd.it/4wIx49,2,,"Mildly entertaining but where Jaws really held the tension, this one has some chase scenes. Also, I thought it was over and then it went on like 45 more minutes or something.",deleted,2023-07-16
2023-07-17,Evil Dead Rise,2023,https://boxd.it/4wWEvf,4,,"Solid. I wish I had never seen an Evil Dead in my life, because this would have been off the hook original. As is, I think it has an extra bit of awful horror to it as a mom jacks her kids up and terrorizes them. I'll be honest, fairly hard to watch with that.

Great setting, really good job by the freaky mom.",,2023-07-16
2023-07-18,The Whale,2022,https://boxd.it/4xhLav,3,,"This is a pretty good movie that I never want to see again. There are no good people in there, and I swear this is all representative of people I know, some fairly well. This will haunt my dreams.

All the stars I give are for the power of cinema, the people kinda acted their asses off for this.",,2023-07-17
2023-07-18,The Cabinet of Dr. Caligari,1920,https://boxd.it/4xhR3l,2.5,,"It's sometimes interesting to think of what movies were before we knew what they were. People were trying some crazy stuff. This was all artistic crazy, the sets were evocative but not realistic. The story isn't much to get on about, and it's silent so it's hard to figure out what's going on in some ways. I imagine in 100 years when there is full sensory movies projected into your skull people will think the same thing about the movies I love.

Unless you want to cross one off of 1001 movies to see before you die, you don't need to watch this one imo. But it could have been much worse, so I'm thankful it wasn't like 'intolerance' or something.",,2023-07-17
2023-07-18,You're Next,2011,https://boxd.it/4xhZ1d,4,,"This hits some notes that 'Ready or Not' takes to the best level, but if you are tired of seeing perfection you can look at this. I don't think the actors in this one are as good all around, and I don't want to say too much to spoil the ending. If you are a rich person and don't like rich people being portrayed in a poor light, this is probably not for you.

Maybe I should start a list called 'Eat the Rich' and this would go on that list. Yeah, that sounds like a thing.",,2023-07-17
2023-07-23,I Am Legend,2007,https://boxd.it/4yXj8z,4,,"I've read the story a couple of times and I loved the ending. This movie doesn't have that ending and it loses a star with the sappy ending it does have. Will Smith is amazing in this one, and his loneliness and grief at being unable to have stopped the outbreak from happening comes through strong.",,2023-07-22
2023-07-24,Alien³,1992,https://boxd.it/4zyO8T,2,,This is grim and kinda weird. Everyone and everything you like gets destroyed. How this franchise kept going after this is beyond me.,deleted,2023-07-23
2023-07-24,Audition,1999,https://boxd.it/4zEyi1,4,,"This builds up slow and then it's a fevered nightmare. It's hard to watch this with subtitles, and I dock it a little for moving a bit too slow.

Gotta keep it, this is my generations fatal attraction.",,2023-07-23
2023-07-25,Jack-Jack Attack,2005,https://boxd.it/4A61SV,3.5,,This and the Lava short were on heavy rotation for.about two years. I think it's funny even though it un-lady or the tigers the bit from the movie.,,2023-07-24
2023-07-29,The Long Hair of Death,1964,https://boxd.it/4BmRST,2,,"It has some atmosphere, but the plot isn't enough for me to really care about it as a movie. Awesome title.",deleted,2023-07-28
2023-07-31,Pretty in Pink,1986,https://boxd.it/4CpONr,3,,"I don't think anyone in this movie is acting great, but it feels a lot like teenage angst so I give it some love. 

Blaine is boring as dirt.",,2023-07-30
2023-07-31,Jojo Rabbit,2019,https://boxd.it/4Cshd7,4.5,,Didn't know what to expect and got an amazing bizarre film. Hitler as a lovable childhood imaginary friend is not the weirdest thing going on in the movie.,,2023-07-30
2023-08-04,Broken Blossoms,1919,https://boxd.it/4DH1BV,2,,"This seems like a fairly straightforward story. Girl has a boxer as a dad who is abusive and terrible. An emigrant from China falls for her and kinda saves her from her wretched state. The abusive guy catches wind and awfulness ensues.

Given that the Chinese guy is played by a white guy squinting, I was really surprised at how tolerant the story was to the people involved. The narrator that is, everyone in the movie is casually slurring the Chinese guy. 

Features a long bit of boxing between people that don't look to be in the same weight class. The object of affection is probably underage. ",youtube,2023-08-03
2023-08-08,Argo,2012,https://boxd.it/4F1MAz,3,,"In one sense, I really like that the crisis and this plot to get the people trapped in Iran out got some exposure. I'm not sure a lot of people know about this. However, this felt like there was a lot of time spent on the drama of will these people escape when I felt no tension there because I knew it worked out. I would have liked to see more of the ludicrous nature of film making as a cover story tbh. Anyways, I won't delete it since it won best picture, but this doesn't really do it for me.",,2023-08-07
2023-08-11,Annabelle,2014,https://boxd.it/4G7AKD,2.5,,This had a couple of creepy moments in it but the end where some random laid down her life to save a baby made me take a star and a half from it. Gross.,,2023-08-10
2023-08-11,Sinister,2012,https://boxd.it/4G7CpR,4,,"As a parent, this one was hard to watch in the dark by myself. That's when I know I got the creeped out good shit.",,2023-08-10
2023-08-14,Get Out,2017,https://boxd.it/4HaDC3,4.5,,"Don't trust rich white people. They are up to no good. 

On rewatch I really like the layers on this. I can't imagine the paranoia people might feel around white people, especially rich white people. I think of it as being similar to when I'm out of my cultural norms but it's gotta be much deeper and scarier for sure. The pacing, the discovery of how deep the depravity goes is just really a grand slam of a film first time out.",,2023-08-13
2023-08-16,Hereditary,2018,https://boxd.it/4HAr9l,4.5,,"This movie is full of dread and horror around family and the people close to you. Tension builds throughout with a gut punch or two, no jumps.",,2023-08-15
2023-08-16,Thir13en Ghosts,2001,https://boxd.it/4HOgP9,2,,Feels like it's superficial and tropes carry a lot of the storytelling weight. I also don't like a fair amount of the cast.,,2023-08-15
2023-08-26,The Fox and the Hound,1981,https://boxd.it/4KCJ7j,3,,"I saw this in the theater when it came out, and I remember it being kinda sad and melancholy (not that I knew what the word meant then). Watching it as an adult with my little kids I still think it's a more grownup story then you'd expect from Disney, as well as there is a dude in here that is just savage, mean and terrible. He shoots up a lady's truck, continually tries to kill his neighbors pet with a gun, gets mad when he fails to kill the pet and his own pet gets hurt due to recklessness, trespasses and hunts game in a preserve. He is a dangerous oaf that does not get his well deserved come-upance. 

I like the ending between the animals, and I found it well done and not just a hodge podge of old animations laying around reused for a dumb story. Not a ton of songs, which also is alright. But that hunter guy is just an awful human to show people in this day and age.",,2023-08-25
2023-08-26,Xtro,1982,https://boxd.it/4KPLTP,2.5,,"I'm not into body horror, this movie has got tons of that. I saw a full grown man be born tearing the lady he was in apart. I saw tentacles and hand claw things launch out and wreck people. There was this gross puppet that probably consumed most of the budget.

Also, out of nowhere really came a clown and I really thought I was paying attention but wtf.",deleted,2023-08-25
2023-08-26,The Witch,2015,https://boxd.it/4KPN79,4.5,,"This is a period piece for people who don't like pride and prejudice and instead like horror movies.

The terror of living in an alien world convinced that god and the devil were battling over your soul. This is what is on display here. Everyone acted their asses off for this one. Dark and atmospheric, this one you have to hear the whispers and anguish in the voices of the people you are seeing or it loses like half it's stars.",,2023-08-25
2023-08-27,The Witch Who Came from the Sea,1976,https://boxd.it/4KWZev,3,,Man this lady seems very thirsty and kind of pissed about it.,,2023-08-26
2023-08-27,Willow,1988,https://boxd.it/4KZ1LP,2.5,,"I watched this when it came out as a kid, thought it was alright. Watched it with my kids and thought it was kind of annoying and silly. Sword and sorcery with a bunch of poop jokes and love potion shenanigans.",deleted,2023-08-26
2023-08-28,Wrong Turn 3: Left for Dead,2009,https://boxd.it/4LxaPJ,2,,"I guess by this point in the franchise we are having hillbilly mutants hunting people is the backdrop to a different more cliche movie. Prison break gone wrong movie here with mutants hunting people either freakishly well or terrible depending on where the drama needs to be I suppose.

This wasn't as bad as the second one. But it's pretty bad. And the graphics are in that awful time where people thought computers could fix it in post but most definitely could not. ",deleted,2023-08-27
2023-08-28,The World's Greatest Lover,1977,https://boxd.it/4LxhW3,1.5,,"It's just not my bag, this is pretty silly.",deleted,2023-08-27
2023-08-29,Oppenheimer,2023,https://boxd.it/4LCYc3,4,,"I really enjoyed the telling of the story, the use of sound and visuals to convey feelings and put you in the time. I felt like this needed to be edited a bit, there's like 3 or 4 storylines interleaving here and I don't think there's great satisfaction in how any of them end. The problem of course with history is that it never truly ends unless you catch the atmosphere on fire.",,2023-08-28
2023-08-29,Count Dracula's Great Love,1973,https://boxd.it/4LQrJV,1,,"The bachelor but the contestants take off their tops and a vampire bites you instead of not giving you a 🌹

I've never actually seen the Bachelor so I'm really on going on vibes.",,2023-08-28
2023-09-04,Slender Man,2018,https://boxd.it/4NDr59,1.5,,"I think slender man is a bit creepy when he's just out in the background or hanging out on the periphery but when he starts chasing people around it loses a lot.

 ",deleted,2023-09-03
2023-09-04,Children of the Corn II: The Final Sacrifice,1992,https://boxd.it/4NDx6d,1,,This is not very good. It's also pretty 90s.,deleted,2023-09-03
2023-09-11,Big George Foreman,2023,https://boxd.it/4PGqfh,2,,"Good on George fo lloving Jesus and making a comeback. I think the movie was pretty dull, I'm sorry.",,2023-09-10
2023-09-12,Space Thing,1968,https://boxd.it/4PXgqX,1,,This is soft-core porn with a sci-fi story gluing the nakedness together. ,deleted,2023-09-11
2023-09-12,Private Benjamin,1980,https://boxd.it/4PXSTX,2,,"I support the young privileged lady taking the hard road to make something of herself, but IDK this has got some really bad vibes in it.",deleted,2023-09-11
2023-09-15,Jocks,1986,https://boxd.it/4QEMq7,1.5,,"This movie reminded me that there were a lot of movies that were glorifying these talented dirtbags that were kind of sleazy  but not really mean. I think this influenced how I grew up.

Anyways, this is a movie that's kind of like major league in that a bunch of misfits are trying to win a sports thing to turn the tables on an evil boss. It's got a little Las Vegas in the 80s, a whole bunch of unresolved plot and alcoholism and boobs. There is a bunch of tennis being played badly.

IDK, watch The Hangover if you want to get some Vegas on you, watch Major League for the other bits. This movie isn't necessary, and I'm deleting it.",deleted,2023-09-14
2023-09-15,Hobgoblins,1988,https://boxd.it/4QETnJ,2,,"You know that scene in ""They Live"" where the two wrestlers fight about putting on sunglasses for like ever and it's pretty great?

This movie stops cold for way too long so two meatheads can fight with garden tools over, nothing. They don't even have sunglasses that they are upset about. Then people hold puppets against their bodies and pretend like they're getting mauled.

I would hate to be an actor. I give this an extra star for the rake fight, I guess that was something I'd never seen before.",deleted,2023-09-14
2023-09-17,The Wild Party,1975,https://boxd.it/4Rb3yr,1.5,,"My rating is with Raquel Welch bumping it up.

This seems to be a movie about people clutching after glory when they are past their prime and how they accept that. It kinda does that poorly in my opinion. It also seems to want to show you how old school hollywood just got down to orgies when the time was right.  This happens right toward the end.

I think Once Upon a Time in Hollywood looks at some of the same bits about humans wanting to keep being great as they slip from public view and it's done right. Go watch that I guess.",deleted,2023-09-16
2023-09-18,Death on the Nile,2022,https://boxd.it/4RBHKz,2.5,,"Pretty sweet mustaches are sported here and you get to find out the origin of Poirot's. I think I've read and watched too many Agatha Christie things because I guessed what was going on pretty early. So the only thing left to do was.enjoy the stunning scenery. CGI snake looked like garbage.

And also now.i want to take a cruise on the Nile. This is promo that better be available.  Champagne and murder mystery are optional",,2023-09-17
2023-09-21,The Crawlers,1991,https://boxd.it/4SqYIx,1,,"This is pretty abysmal all around, tree roots are attacking people. This is about as interesting as ""The Happening"".

I give it slightly higher than bottom rate marks because when the people are getting strangled by roots, it's a bit horrifiic.",deleted,2023-09-20
2023-09-21,Color Out of Space,2019,https://boxd.it/4Sr3wh,3,,"My mind couldn't slip the thought of this being an alien invasion movie, but the alien is the color pinkish purple. That said, I liked a bunch about this. Poor alpacas.

I'll keep this one. I've seen several Lovecraft adaptations, I think this one is pretty good.",,2023-09-20
2023-09-26,Red Heat,1988,https://boxd.it/4TSR1r,2,,"It's not a horrible movie. Buddy cop movie but it's really not elevated with Belushi. If you want to watch a mismatch movie with Arnold, watch Twins. If you want to see Arnold being a cop maybe Kindergarten Cop? You want to watch buff naked people fight in a bathhouse I'm going to say Eastern Promises? 

This movie isn't great and time isn't making it better.
",deleted,2023-09-25
2023-09-26,Sweet Sixteen,1983,https://boxd.it/4TTaJH,1.5,,"This is an odd movie. It's about a small town that has a new family come in to town, and the 15 year old (almost 16) girl is trying to pick up guys at the local bar from the get go. Then she showers and later skinny dips and I guess this was ok in the 80s? Also, there's lynching and hardcore racism against native people in here.

I give it more than the bare minimum because I thought the sheriff role was alright. But this is a murder mystery it is unlikely you will figure out, and also I'm not sure I understood the ending entirely.",deleted,2023-09-25
2023-09-27,Nocturne,2020,https://boxd.it/4TZRlF,3,,"This really didn't seem to have many surprises, but it's a tragedy in the old school sense with a bit of devilry in it. You watch as a supposedly mediocre sister lashes out to shine bright. Well acted and great accompanying music, I don't give it higher marks because you kinda see what's coming a mile away and then you watch as that happens.",,2023-09-26
2023-09-27,Black Mirror: Shut Up and Dance,2016,https://boxd.it/4U06d7,4.5,,"Black Mirror has a few episodes that are just crazy stories that you can't believe they put on video. This is one of them. I won't spoil anything about it, but it's highly uncomfortable viewing for a lot of it.

For the lulz.",,2023-09-26
2023-09-27,Alien Resurrection,1997,https://boxd.it/4U0P79,2,,"This is better than the third one, but that is damning with faint praise. It's got some space pirates, corporate machinations, doomed Ripley and some kind of robot that's not really a robot? IDK.

This has a lot going on, some of it's fun. But unless you are a completionist I don't think there's a reason to watch it.",deleted,2023-09-26
2023-09-28,Beware! The Blob,1972,https://boxd.it/4UemFz,1.5,,"This is campy as all hell. Also, super anti-hippie. The late 60s/early 70s were a time unlike others I guess is the point of this movie.

Also, the boyfriend seems super into avocado sandwiches. Like to an unhealthy degree. And they stole the soundtrack from ""Last House on the Left"". And they show this kitten for like a good 3-5 minutes as it plays around in some meadow and then they blob it. Who is this movie for?",deleted,2023-09-27
2023-09-28,Bite,2015,https://boxd.it/4UlaZh,2.5,Yes,"I thought I deleted this looking at my notes, but here it is again. So gross but you know a lot of these folks kinda got what they deserved. The main character and her actual friend didn't but man was that blonde lady, boyfriend and mom were the worst.",deleted,2023-09-27
2023-09-29,Pledge Night,1990,https://boxd.it/4Uuz3Z,2,,"This is some really trashy cinema. I feel like it could use some editing, there is entirely too much of hazing before it takes a hard left into a ghost/zombie/whatever story of revenge. But even if you shorten that up you have 2 minute clips of a ghost walking around aa house looking for the last few people, like meandering through a mall.  

The story is all over the place. As a brief glimpse into the silliness of the plot, the zombie ghost decides to rape a sorority girl and when is stopped by the final boy he says in all earnestness ""I only came here to protect you"". WTF ghost?",deleted,2023-09-28
2023-09-30,Dead Men Don't Wear Plaid,1982,https://boxd.it/4UOApH,2,,"It was cute for a few minutes, and I like the idea of working in old noire films to serve your purposes for some laughs but it got old kinda quick.

My favorite comedy from Steve Martin is the absurd things he says

""When I arrived in Carlotta, I thought of the words Marlowe had said to me over fifteen years ago: Dead men don't wear plaid. Huh. Dead men don't wear plaid. I still don't know what it means""

But there aren't enough gems to keep this one. I liked The Man with Two Brains more.",deleted,2023-09-29
2023-09-30,The Babysitter,2017,https://boxd.it/4UZdBR,3.5,,"This movie is a stomping good time. It's cheese but damn fun to watch. I don't want to say anything about the story, I think it's best if you just stumble on it.",,2023-09-29
2023-10-04,Asylum,2008,https://boxd.it/4Wcdy9,2,,I'm not sure why there's so much hate here. It is a little by-the-numbers haunted house kind of movie but it was acted alright and had decent effects. Y'all need to go watch some actual garbage and give this the mediocre rating it deserves. Maybe there's just no excuse to make a decent looking movie with such a blah story.,deleted,2023-10-03
2023-10-04,Wicked Lake,2008,https://boxd.it/4Wf5pJ,0.5,,"This isn't sexy enough or naked enough to be porn and it's too badly acted, poorly written and silly to be a scary movie or a thriller. And it has some weird filler where the hillbilly family has a sympathetic character but then uses the character as comedic relief.

The twist could have been good if it wasn't hinted at up front and the walking home scene in the beginning was just all kinds of junk. I think coming in thinking you're getting hillbilly horror and it turning into a revenge movie is kinda awesome, someone competent should write that.

I wrote so much about a half star movie cause I think the premise could of been pretty bad ass and it was so, so bad in almost every way.",deleted,2023-10-03
2023-10-06,Child's Play,1988,https://boxd.it/4WSrsj,3,,"This is a little cheesy but still little doll things creeping on you is scary so I like it and give it some love.

Still, think about what they do to this kid. On super circumstantial evidence that a murder even happened they lock the kid up in a psych ward. Seriously, ACAB.",inflight,2023-10-05
2023-10-08,Thinner,1996,https://boxd.it/4Xswr3,2.5,,"I am pretty sure I read this back in the day with the other Bachman books in a anthology. I thought dealing with gypsy curses wasn't a super great look at the time and it still isn't great. I feel like the book gave them more depth as people trying to get by and the movie dealt in a fair amount shallow stereotypes. You also don't get to explore the idea that Billy really does unleash a curse on the people and is also unsure of how to take it back. 

The effects are pretty great and  I like the tragic kind of ending. But it's not awesome enough to keep around, I'd rather read the book again than watch this.",deleted,2023-10-07
2023-10-09,Eight Legged Freaks,2002,https://boxd.it/4XSNOb,1,,"Maybe would have been better if the spiders weren't making gremlin noises the whole time. Goofy as hell and like so many people die. It's crazy, tone is all over the place",deleted,2023-10-08
2023-10-10,Malignant,2021,https://boxd.it/4YcKaR,3.5,,"That was pretty unexpected. 

This movie has a few. violent kills and then goes full on berserk.  I am not sure I really like the reveal of the monster, but full marks to the stunt coordinator/people for this. 

I wish I had watched this not on a plane, given a better environment and screen I think this might have been crazy fun to watch.",,2023-10-09
2023-10-10,Revenge of the Nerds II: Nerds in Paradise,1987,https://boxd.it/4Yey89,1.5,,"This one takes out the assault and just ups the bullying and haves fun with that for a bit. Silly and outlandish, there isn't anything that you'll need to make sure to see, so you can skip it entirely.",deleted,2023-10-09
