Date,Name,Year,Letterboxd URI,Rating,Rewatch,Review,Tags,Watched Date
2024-04-10,The Princess Bride,1987,https://boxd.it/6fkl21,5,,"I saw this in the theater and I remember two things:

1) When Buttercup says ""I will never love again"" my friend in junior high wit turns to me and whispers loudly ""LIAR!"" then cut scene to buttercup getting engaged was so damn funny.
2) The movie was amazing. A fairy tale movie for everyone. Great writing, framing it as a story being read to a kid by his grandpa, everything was amazing.

Watching it again I still thinks it is a great movie.",,2024-04-09
2024-04-10,Austin Powers in Goldmember,2002,https://boxd.it/6fvfkP,1.5,,"Mike Meyers in the quest for more money I guess. This is a bunch of the same gags from the last two and I can do without that. The first one had a bit of heart and the gag of what would a guy from the 60s think of the 90s and how would that land with modern people was much funnier than the juvenile humor just taking over everything.

Completely unnecessary.",,2024-04-09
2024-04-11,Beyond Atlantis,1973,https://boxd.it/6fIsM9,1,,"This movie is 'merican as all hell. Some really sleazy dudes hanging out in Philippines buy some pearls, figure they should go steal that shit, put together an expedition, make contact with an ancient civilization, burn it down and murder like half the people and get away clean. 

My description makes it sound more fast paced than it really is. The movie is pretty boring and there's a lot of underwater filming where you're looking up someone's backside, usually some blonde lady that is hanging out with the Atlantean's.

Anyways, I deleted this so you didn't have to.  ",deleted,2024-04-10
2024-04-12,Back to the Future,1985,https://boxd.it/6g0Fyl,4.5,,"I hadn't seen this one in so long, thought I'd revisit the series. Much like Indiana Jones I remember liking the first and third ones quite a bit, and the second one being pretty weak. This is still my impression, loved this movie again. I dock it half a star because I think the assault as a plot point makes me shy away from whole heartedly recommending it as a family film.

I am a child of the 80s, so my rating is quite tainted by my still being able to look at Marty in the 80s and saying ""That is now, the stuff from the 50s is the past"" which I think is important for some jokes to land. I think this is a great movie, It's effects still look pretty good (shockingly) and I really like the touches they put on Marty's travels affecting lots of little things not just the parents destinies.

I know the ending hits a little weird, thinking that George has kept his wife's would-be rapist just hanging about as a peon to belittle. I never even really thought about it until this most recent viewing, I thought it was important to show how the evil person got his comeuppance. The role-reversal is used to show how the present has been changed for the better in a pat neat way. This series doesn't invite too much deep thought about how time travel would really work and instead just provides entertainment. (see https://arstechnica.com/features/2023/11/the-ars-guide-to-time-travel-in-the-movies/)

",,2024-04-11
2024-04-14,The SpongeBob SquarePants Movie,2004,https://boxd.it/6gWS7t,3,,"I missed out on sitting couch bound and watching spongebob, so this to me is just a kinda mediocre movie. My kids seem into it though, so I guess I have to keep it.

Patrick and Spongebob go on an odyssey to find a stolen crown. Shenanigans ensue. Patrick did make me laugh a bit with the exchange:

""Did you see my underpants?""

""No""

""Did you want to?""

 ",,2024-04-13
2024-04-14,Arsenic and Old Lace,1944,https://boxd.it/6gYorR,4,,"This was on video tape in my house growing up and I've seen it like 20 times. We use this to screen whether you get to marry into the family.

It's farcical story about a bunch of crazy people living in Brooklyn and a wacky cary grant discovering the crazy at a very inopportune time. It's like 80 years old but you can sympathize with the plights of poor Mortimer just the same. It's pretty rare that a movie that old makes as much sense as this, especially since it's nonsensical as a plot point.",keeper,2024-04-13
2024-04-15,Forgetting Sarah Marshall,2008,https://boxd.it/6hblqd,4,,I went into this movie cold when I first saw and thought it was amazing. Very heartfelt and funny. Stacked with a bunch of really great actors even playing little bits they carry this film and land crazy one liners. It is a romcom unlike anything I've really seen before.,,2024-04-14
2024-04-15,Leo,2023,https://boxd.it/6hw5t3,2,,This is completely forgettable. Class pet teaches kids how to be better.,,2024-04-14
2024-04-15,The Bay,2012,https://boxd.it/6hysXJ,3,,"This was decent found footage horror about an outbreak ignored jaws style until it results in carnage. 

Its kinda gross out horror, so I don't give it more stars but it'll freak out people if they buy into the premise. Eco disaster movie done right I suppose.",,2024-04-14
2024-04-15,King Solomon's Mines,1985,https://boxd.it/6hyMxr,1.5,,"I'm going to presume the source material was just racist as hell and it carried through. This is what you'd get.playing Indiana Jones with some slapstick I guess, it comes across like almost a parody.",,2024-04-15
2024-04-16,Hellraiser,1987,https://boxd.it/6hSxDf,3.5,,This is a pretty good adaptation of the story. The effects around Frank being all wet and gross walking around are pretty good. It's interesting to think that the story of a idea of hell is really just people that are trying to show you sights of pain with promises of pleasure would spawn like 10 movies. I think the first couple are pretty good but after that it's just a lot of nonsense.,,2024-04-15
2024-04-17,This Place Rules,2022,https://boxd.it/6i3BoF,2.5,,"I appreciate that this tries to show a balanced look at how things escalated to what they did, but the actually interviews and talking with people about what happened on jan 6 seems to take a backseat and in the end the analysis I feel that is come to is:

Extremism on both sides goaded one another to larger and larger acts of violence and extremism from the right leadership took advantage of the situation and caused a full scale riot inside our nation's capitol. 

This is a fair assessment I think.  But other than casting both sides as attention seeking swamp dwelling influencers willing to fight each other for views and likes, I don't think there's much else that's brought to the movie. If you're going to go into the rallies and brave the vitriol of the people you are interviewing, it feels like deeper thought about what happens next is appropriate. I didn't see that.",HBO,2024-04-16
2024-04-17,The Toy,1982,https://boxd.it/6i4wl9,1,,"I guess in 1982 people were cool with joking about rich white people buying black people. It's possible that the plot of a rich kid wanting to be loved by his father and someone showing him boundaries breaks through to him. But what I see is too problematic to get over. This movie didn't even make me chuckle.

You want to see a rich person learn some manners? Maybe Overboard? Although the plot there is pretty terrible too. ",deleted,2024-04-16
2024-04-17,Trick or Treat,1986,https://boxd.it/6ia4iD,2,,"This movie soundtrack is like the music of my junior high years. It is definitely doing some of bumping up of my rating. The story reminds me a bit of Nightmare on Elm Street 2, with the outcast fighting back against high school bullies and unleashing a little more death than they intended to. 

Anyways, if you want to get that kind of a thing I would recommend Elm Street 2 over this for sure. This has a heavy metal vibe and portrays the metal head of the school as I saw them when I went, kind of an outcast and loaner. Later years they would portray these kids as just nihilistic trouble makers.",deleted,2024-04-16
2024-04-17,Tron,1982,https://boxd.it/6ia9Qb,2,,"Of all the movies that deal in gross misunderstandings and inaccuracies with computers and programming, this one does it the hardest.",deleted,2024-04-16
2024-04-20,Get Him to the Greek,2010,https://boxd.it/6ji00F,3,,"Not as good as Hangover but in the same vein as it.  It's got some kinda life message that rock n' roll lifestyle isn't for everyone. This cuts into the comedy some.

This is decent, but I don't have to see it again.",,2024-04-19
2024-04-22,Hellbound: Hellraiser II,1988,https://boxd.it/6kegvl,2,,"Some of this is pretty sweet still. Still great one-liners from a few different people but the world building they wanted to do here looks really bad now and the doctor ""taking over"" doesn't make a lick of sense. 

Despite it having some cool ideas, I would pass on this. ",deleted,2024-04-21
2024-04-23,Hellraiser III: Hell on Earth,1992,https://boxd.it/6koGBz,2,,"While this completely disregards what little rules and mythology that have been established in the first two movies, I enjoyed it a bit more than the second one. I guess the unifying theme that I think is interesting and what is still here is the idea that people can be enticed to do terrible things with the promise or hope of great pleasure. We might know someone (or maybe we are the someone) who is so burnt out on the world that they think they would take this deal of unfathomable suffering just to feel something. But it's really only a fleeting glimpse of this idea and it really leans heavy on this just being hell themed mass murder. With a lot of magic. This makes it not creepy or scary to me in any way.

I'm really glad the upgraded the statue from the second movie to something a little more serious. The first statue looked like garbage hammered together.",deleted,2024-04-22
2024-04-24,Hellraiser: Inferno,2000,https://boxd.it/6kK1MZ,2.5,,This seems like a black mirror episode with a hellraiser theme. It's really not bad if you aren't expecting a Hellraiser movie. I actually kinda liked it.,,2024-04-23
2024-04-30,The Killer Eye,1999,https://boxd.it/6nrUmV,2,,"To quote the movie, ""That was some whacky shit, yo""

Did you intend to watch a movie about an eyeball puppet screwing a couple of women like some kind of hentai but way tamer? Then this is the movie for you.",deleted,2024-04-29
2024-05-03,Vacancy 2: The First Cut,2008,https://boxd.it/6oI2D7,2,,"I guess I have to go back and watch the first one again, because I don't understand how the last 5 minutes follow the whole rest of the movie. It's just the dude that got set on fire right? And there's still like shotgunned people in a house nearby or did he clean all that up too? And does he just set up shop in the place they was a buncha murder and people just didn't notice or what?

IDK, I remember kinda liking the first one, but I don't want any more of this. The dude isn't freddie or something, one was enough.",deleted,2024-05-02
2024-05-10,The Ballad of Tam Lin,1970,https://boxd.it/6rDJz5,1,,Moody and atmospheric and set in the late 60s it looked like. Lots of brooding young dudes. I couldn't figure out what the hell was going on so I dropped it.,deleted,2024-05-09
2024-05-10,They All Must Die!,1998,https://boxd.it/6rEA61,0.5,,Seriously racist and awful. ,deleted,2024-05-09
2024-05-10,The Boogey Man,1980,https://boxd.it/6rFZ4r,1.5,,"This was kinda slow and I have no idea what it has to do with the Stephen King story The Boogey Man. This had a haunted mirror, and some ghost killings. I think it was an ok enough idea with a possessed mirror but it really doesn't go anywhere too fun or scary for me.

",deleted,2024-05-09
2024-05-11,Fury,2014,https://boxd.it/6rMIE7,4,,"This movie to me depicts war very well. The bleak awful nastiness of it, the breakfast scene full of so much tension and resentment. I would give it full marks except I think the last stand bit in the final scene is too Hollywood for me. It detracts from a brutal depiction of war as just killing until the killings done and elevates the crew to be heroes. 

",,2024-05-10
2024-05-11,The Happening,2008,https://boxd.it/6s44s7,1.5,,"The scenes where people become influenced and off themselves is creepy and disturbing. There are few well placed visuals throughout when showing this theme. The acting by the main characters is laughable. There's a part where an old lady says to Mark Wahlberg ""you intend to murder me in my sleep!"" And his golly g tone as he says ""no ma'am I would never do that"" made me laugh out loud. Watch for it towards the end if you dare.",deleted,2024-05-10
2024-05-12,ABCs of Death 2,2014,https://boxd.it/6sdOEL,2,,"Anthology of 26 movies with quick little concepts about death and horror. Most are just kinda forgettable even if decently done. Some are really silly, some are terrible, some are fairly well done and worth looking at:

- A is for Amateur is pretty good.
- M is for Masticate is excellent.

I'll keep it just for M. That shit was amazing.
",,2024-05-11
2024-05-16,The Phantom Carriage,1921,https://boxd.it/6tTGdv,2,,"This reminded me a bit of 'A Christmas Carol' except instead of a evil rich guy we have a evil poor drunk. I usually don't go in for given extra stars because something was cutting edge for it's time so I will give it a couple stars because it was a decent story. TBH, I would give it more but the main character is such a terrible person in a variety of ways I don't have much sympathy for him being saved in the end. ",youtube,2024-05-15
2024-05-16,Nosferatu,1922,https://boxd.it/6u2gIP,2,,"I am an 80s/90s kid, so for me this is not a thing compared to Bram Stroker's Dracula. It's silent and there's a lot of reading where not only are words conveyed through cards but what the characters are reading and writing to one another. Here are some notable cool things as I watch it:

- I love the little skeleton clock in the castle, that is an awesome thing.
- There's lots of play with shadows and kind of creeping horror here.  Also shots tend to show the count as elongated and weird looking.
- I like how the guy in the castle, Hutter, is reading about vampires and throwing it down like ""That is some bullshit there"" and laughing at it.

I removed this one from my collection. It had a really hokey soundtrack to it, hard to take it seriously.",deleted,2024-05-15
2024-05-16,After.Life,2009,https://boxd.it/6u2G3D,3,,"This is a little too pat with how things worked out in this one but despite that it's creepy and Liam Neeson sells this well imo. It's got a hell of a downer ending that was very common in the aughts, and an awful lot of naked Christina Ricci which I was not expecting from a movie from the aughts. I don't know why I don't like him, but Justin Long does not help this movie. I would say that Ricci is also acting really wooden and uninterested but that's kinda the point. She's supposed to be someone that's drifting through life and is trying to let go of their life on the advice of their undertaker.

If you want to watch an autopsy movie, I'd go with The Autopsy of Jane Doe instead of this. But this isn't as bad as all that.",,2024-05-15
2024-05-17,Oculus,2013,https://boxd.it/6ulKnZ,3.5,,"This movie is a bit of the shining and has a few good really unsettling thing in the mirror isn't the thing you see in real life but then it is. Creepy stuff. I like how they interleave the past family tragedy with the present. I'll agree with a previous review, imagine you are locked up in an institution and your sister meets you on your release wanting you to relive the trauma in your childhood home. This lady has zero f*cks for your personal growth.",,2024-05-16
2024-05-18,The Ballad of Buster Scruggs,2018,https://boxd.it/6uIDXx,4,,"A collection of weird western stories, great acting and just a delight to watch for the most part. I didn't care for one or two, but I'll forgive the movie since the majority were bangers.",netflix,2024-05-17
2024-05-19,Finding Nemo,2003,https://boxd.it/6v0vKB,4,,I've got kids that this hits the sweet spot for. I think it made one of them want to be a marine biologist. At least they didn't want to become a dentist I suppose.,kids,2024-05-18
2024-05-21,Bad Lieutenant,1992,https://boxd.it/6vVlsB,3,,"The 90s were goddamn dark. This could be a double feature with Leaving Las Vegas.

Can't say I liked it. I am unable to connect with miserable condition of the titular LT since he is such a ridiculously terrible person I kept hoping throughout that he would just get someone popping him in the head or the bookie would do the right thing and burn his house down. The ending was a bit confusing.",deleted,2024-05-20
2024-05-21,Stardust,2007,https://boxd.it/6w2Flp,5,,"This movie is like the aught's Princess Bride. My favorite part is when the witch turns a goat into a dude, that guy is acting his ass off.  

This has magic, lightning pirates, fencing, revenge, true love.

I wanted to dock half a point because I think the acting is a little stiff sometimes and the montage to get Tristan to be awesome is a little silly but honestly I can't. This is pretty great.",,2024-05-20
2024-05-22,The Searchers,1956,https://boxd.it/6wgYwJ,2,,"I give it some credit for it's beautiful countryside and showing violence between the native Americans and settlers as being senseless and without glory for the most part. I also liked that John Wayne didn't just expect to murder Indians by the bushel out in the country, he showed cautious respect for the danger they posed. 

They shied away from it being completely senseless with the end, they tied it up too nice for my tastes. IMO, the two needed to come home to kid having lost his chance at a good life with a good woman and John Wayne hanged for murder for shooting a white guy. That would have been some bleak shit I could have gotten behind.

Look, you want to watch something that has hard men struggling with their nature and the country around them go watch Unforgiven. You don't need this in your life and I'm surprised that it's in the 1001 movies to watch before you die. I didn't need to see that.","deleted, hbo",2024-05-21
2024-05-22,Secondhand Lions,2003,https://boxd.it/6wibmJ,2.5,,"This isn't high cinema or anything and I dock it a star for the kid in this that I've had to see pull on heartstrings for more than a decade. But I'll always enjoy watching an old man beat up hooligans, that's the stuff. It gets some middling rating and I won't keep it. Good hangover movie maybe.",deleted,2024-05-21
2024-05-23,The Gold Rush,1925,https://boxd.it/6wzOID,2,,"I understand how it is derivative of this movie and Keaton's other stuff, but I saw all these jokes as a kid watching Bugs Bunny pictures. I can respect the practical effects and gags for being something you just don't see anymore. I especially thought the running against the wind was a good gag and well done. It's nostalgia talking, but I'd keep some looney tunes instead of this. The cartoon medium makes it more appealing with the zany antics and murder jokes a little less serious.",youtube,2024-05-22
2024-05-23,The Frighteners,1996,https://boxd.it/6wN85n,3.5,,"This is very zany and full of some pretty unique characters. I like the story line for the most part and I really like the swing on this. It might be a bit of a miss, and the effects don't hold up much but if you haven't seen it and don't mind some horror comedy then this is a good 'un.",deleted,2024-05-22
2024-05-25,Catch-22,1970,https://boxd.it/6xrLur,2.5,,"All the stars I'm giving this are for it's take on modern warfare being deeply absurd. The way the story is told (if there can really be much of a story to say is being told) and the encounters Yossarian has are constant reminders of the futile stupidity of war. I mildly enjoyed how M&M shares kept showing up when supplies were needed and went for and how things started to have the logo more and more as the movie went on. But this wasn't really that funny at all and I usually love absurdist humor.

Maybe the subject is just not funny so I couldn't get into the humor of it all? IDK.",deleted,2024-05-24
2024-05-25,Within Our Gates,1920,https://boxd.it/6xBnD5,2.5,,"Other than as a historic snapshot, I don't know what this one really has for modern eyes. It's kind of twisty and hard for me to parse what's really going on until kind of the end. I feel like it's trying to show the trials and strife black people had from their point of view but it's still got a bunch of stereotypes that I would consider mean and awful. Maybe a hundred years ago it wasn't as bad?

It seems like it's trying to show how unfair and unjust things are for black people.  Shows a guy getting lynched over some crap a white guy did. Seems legit. Hell it shows a guy who was trying to be cozy with white people getting lynched just for being around when their blood was up.",youtube,2024-05-24
2024-05-26,Daughter of Dracula,1972,https://boxd.it/6xL5UH,2,,"It starts kind of moody European horror movie and then it takes a turn into lesbian erotica as the vampiric seducing is a young woman who has Dracula's taste in victim. I was really confused since this was on my watchlist so I thought it was one of the 1001 movies to see before you die but it's just another exploitation film from the 70s.

",deleted,2024-05-25
2024-05-26,The Time Machine,1960,https://boxd.it/6xP5vZ,3,,"I watched this a bunch of times as a kid. On a re-watch I found it a bit of a slog to get through to the part where he's in the distant future. Once it gets there it's still pretty good. I remember the morlocks really freaking me out as a kid.

I think it is hilarious when he gets to the far future and he gets knocked out of his machine and then someone above off camera dumps dry ice pellets on him for no good reason I can tell.",,2024-05-25
2024-05-26,Private School,1983,https://boxd.it/6xUB13,2,,"This is an incredibly horny movie. You'd think it's just the teenagers but no, like everyone is ready to get it on all the time. I guess it's supposed to be a wacky sex comedy but I really didn't think it was that funny.

I somehow missed this living through the 80s but now that I think about it this is probably my generation's American Pie. Somehow I think that there wasn't as much crime in American Pie as there is here.",deleted,2024-05-25
2024-05-26,Flatliners,1990,https://boxd.it/6y2tJd,3.5,,"It's like Gray's Anatomy with a death wish. Buncha pretty people toying with their lives in some of the most visually striking clubs, diners and just general places to be hanging out.

Also, how did the Baldwin atone for being a sleazebag? Maybe I missed that part with Kiefer getting all self-righteous. ",deleted,2024-05-25
2024-05-26,Feast,2005,https://boxd.it/6y36nb,2,,"There is a lot of frantic action in this so you can't really tell what's really happening, you can just tell it's bloody and squishy. Also, within the first ten minutes you get to see a jackalope looking thing hump a moose head.

This is kind of in the vein of like cabin fever meets tremors. I liked tremors way better, I liked some of those people before they got et.",deleted,2024-05-25
2024-05-26,The Fifth Element,1997,https://boxd.it/6y3S8N,4.5,,"This is a crazy good banger. It's got style and looks amazing, has tons of crazy things going on because it's the future and it's just what people are doing and it feels like a rich world that works. Chris Tucker is just amazing in this. I dock it half a star only because I don't think the love story between the leads makes any sense. But seriously, a banger of a movie.",,2024-05-25
2024-05-28,Glass Onion,2022,https://boxd.it/6yYhLd,4,,This was highly entertaining and I'm pretty sure it is basically on the back of Daniel Craig. His character is utterly charming and I could watch that guy oscillate between country bumpkin and incredibly sharp-witted know it all for many hours.,,2024-05-27
2024-05-29,The Town That Dreaded Sundown,1976,https://boxd.it/6zaJ9v,2,,"I don't know where this movie was tonally. There's some gomer pyle nonsense going on with a dude in a pillow case out murdering folks. There were some good cat and mouse chases with the killer, the breathing sounds made it a little freaky but when they cut to the cops and regular folks it got real tired.",,2024-05-28
2024-05-29,Batman v Superman: Dawn of Justice,2016,https://boxd.it/6zp4Gj,2.5,,"I don't like super hero movies. I especially don't care for superman movies as the dude is basically god and I find it boring. This movie plays with the idea of what would humanity really do about a god among us and would we tolerate that. This part of the movie is interesting and good.

The CGI fighting between gods and a billionaire thrown in there for no good reason I can tell is kind of shit. By that I mean it's really beautiful eye candy but it is just a whole bunch of who cares.

I give it an extra half star for the ending. That was gutsy, and I can respect that.",deleted,2024-05-28
2024-05-30,The Texas Chain Saw Massacre,1974,https://boxd.it/6zOqwZ,4,,I don't know what I can honestly add to the many many critiques of this movie. The thing that I always remembered I saw it first as a teenager was the sound. Whoever did the sound for the hammer hitting people it was disconcerting. The movie is basically non-stop eerie and then flat out horrific from the jump.,,2024-05-29
2024-05-31,Betting on Zero,2016,https://boxd.it/6A0Q2Z,2,,I feel like I watched some billionaire's attempt to smear and bankrupt a company because it deserved it. I was hoping dude lost all his money betting on zero and then broke ass had to cash in and only then herbalife falls over. Unfortunately this is not what happened.,deleted,2024-05-30
