Date,Name,Year,Letterboxd URI,Rating,Rewatch,Review,Tags,Watched Date
2021-03-12,Gunpowder,2017,https://boxd.it/1IukxD,3,,"This was a bit odd for me because it's just people being oppressed fighting back and failing to make a difference. I was roughly aware of the gunpowder plot and the little rhyme that goes with it, I was unaware that there was a larger driving force behind the conspiracy.",,2021-03-11
2021-03-15,Gone with the Wind,1939,https://boxd.it/1IU1tp,2.5,,"It's over 80 years old at the last time I watched it. The South apologist nature of the film cannot be denied. However given that it's 80 years old it is an amazing piece of not just historical depiction but of a prominent viewpoint that's within living memory still.

The actress playing Scarlet is so good at showing utter contempt for the people that she's talking to. Her transformation through the film is pretty great to watch.

It's awfully long.",,2021-03-14
2021-03-17,Popcorn,1991,https://boxd.it/1JfOuN,3,,"I used to see this at Blockbuster when I was looking through the horror flicks and the cover always made me say nah. I finally watched it and I didn't think it was half bad. I especially thought the revenge plot of the killer was pretty damn funny and well done.

It definitely reminded me of revenge flicks like slaughter high from the '80s. If you're out to watch a horror movie that is meant to be just enjoyed and not seriously pursued or honestly scared by this is a good fit.",,2021-03-16
2021-03-18,Subspecies,1991,https://boxd.it/1JhseH,2,,This was kind of a wretched movie. I thought Twilight was the first instance of emo vampires but this one definitely had that going on. it also for no real explicable reason had the stop action guys from the gate in it. about the only redeeming thing I found in this movie was I really liked the funeral parade that reminded me of New Orleans and the ceremony towards the end where they check all the graves for undead by seeing if a white horse will jump over them. It was very bizarre and I didn't think I'd seen anything quite like that.,deleted,2021-03-17
2021-03-18,Paranormal Activity,2007,https://boxd.it/1JjjU9,3.5,,I'm a sucker for found footage type movies. I know trying to inject a camera into the situation can make it a little hooky sometimes and the story seem forced but in this case I feel like the reason to have a camera was quite well explained. For as little special effects as they put into this they did a pretty good job. watch us at night with nothing knowing about it going in and I got to believe that you're going to be a little bit freaked out.,,2021-03-17
2021-03-19,City Lights,1931,https://boxd.it/1JsIeP,3,,"This is a hard one to judge. I have a real hard time with 90 minutes of a silent film, but choreographed physical comedy was quite good. I think it's funny because pantomiming and silent films rely completely on the idea of stereotypical characters and tropes to allow the simplistic gestures convey the meaning of the characters. If somebody tries to put that on film these days when they talk they get lambasted for not making characters with depth.",,2021-03-18
2021-03-20,The Silence of the Lambs,1991,https://boxd.it/1JyZOn,4.5,,I think this is a deeply disturbing film.,,2021-03-19
2021-03-20,Unforgiven,1992,https://boxd.it/1JzmZt,4.5,,"Gene Hackman is an incredible actor, and this role he plays full of menace is just beautiful to watch.

Everyone's acting in this film I feel is dead on. I really don't care for westerns very much but this movie is brilliant. The final third has to be some of the best filmmaking I've ever seen.",,2021-03-19
2021-03-21,Star Wars: The Force Awakens,2015,https://boxd.it/1JNe8p,3,,"I don't like the Poe character very much. I like everyone else just fine. I wish they didn't do another death star as the final act of the movie. That's a bit lame.

I give it meh.",,2021-03-20
2021-03-22,The Mummy,1999,https://boxd.it/1JRBVd,4.5,,"While the CGI is showing it's age, everything else about this movie is just spot on for me. It doesn't hit any false notes for me. If it's trying for creepy, it gets it. If it's trying for swashbuckling and some romance that hits true too. If you are looking for an adventure movie about raiding some tombs for glory and treasure this is a great one. If you feel like raiding tombs is colonialist and gross, maybe skip it.",,2021-03-21
2021-03-22,Once Upon a Time... in Hollywood,2019,https://boxd.it/1JU9Y5,4,,"I'm not crazy about the meandering story involving the manson family. I'm tired of fantasy history that terintino peddles. But there are two things I think this movie is amazing for doing. One is the sets are amazing, and bring me back to my childhood in southern california. It's eerie. It's a bit before my time but not enough for me to feel it bleeding through the screen and it was incredibly well done. The second is the whole scene around a bad guy part in a western tv show. It was just stunning acting. I was spellbound through the whole thing.",,2020-09-15
2021-03-22,It,2017,https://boxd.it/1JXhkj,3,,It was just alright,,2021-03-21
2021-03-23,It Chapter Two,2019,https://boxd.it/1JZUEB,2,,"While I found the first part meh, this one actually slipped into kinda action adventure and I got a bit bored. I strongly dislike CGI adventure, it feels so low stakes and borders on wankery to me.",,2021-03-22
2021-04-09,What Lies Below,2020,https://boxd.it/1MtLSH,2.5,,I can't say I liked it. But I really appreciate it when people try toale.something original and this was weird and uncomfortable and creepy in at least two ways.,,2021-04-08
2021-04-12,I Care a Lot,2020,https://boxd.it/1MQgIR,4.5,,Terrifying funny and really well paced. I take a half star only for a little bit of implausible writing and a New Jack City ending.,,2021-04-11
2021-04-13,Legally Blonde,2001,https://boxd.it/1N7vQP,5,,It's frigging heartwarming.,,2021-04-12
2021-04-18,1BR,2019,https://boxd.it/1NO9Y9,3.5,,"Thriller with some paranoia inducing scenes for all of us that have rented an apartment in a new city. Don't ever let people know you ain't got people in the town. Evidently that's code for ""I would.like to be victimized in some fashion.",,2021-04-18
2021-04-20,Thunder Force,2021,https://boxd.it/1O6Ltz,2,,This was pretty dumb. Everything involving Jason Bateman was magic. But it was still pretty dumb.,,2021-04-19
2021-05-12,Ready Player One,2018,https://boxd.it/1R9BQV,2,,"I thought the book was kind of like a buzzword rip off of my childhood and that was kind of sad. Somehow this movie both captured the rip off of my childhood and was a pretty mediocre crap movie.

Super shiny though so I give it more than one star.",,2021-05-11
2021-05-12,Dead Silence,2007,https://boxd.it/1Rab0r,1.5,,I thought it was pretty dumb I'm sorry,,2021-05-12
2021-05-13,Superman,1978,https://boxd.it/1RhkiD,3,Yes,"I've never really cared for the Superman story, so this is hard to judge. I think it's well made and I appreciate the practical effects. Also Cliff clavin is responsible for nuclear weapons.",,2021-05-12
2021-05-19,Psycho,1960,https://boxd.it/1S1LeF,5,,"This movie scared the crap out of me when I was a little kid. Why I got to watch this as a little kid who knows. But that scene where the lady comes out of a side room and it's an overhead shot of the guy going up the stairs. Man.

Watched it now, still find it to be a great film. I do find the smoldering looks between the sister and the boyfriend to be a little odd. ",,
2021-05-19,Nightmare Weekend,1986,https://boxd.it/1S58JH,1,,"What the hell was that.

Also, what is up with the damned puppet playing with an oven?

TW: Sexual Assault and I don't say that lightly.",,
2021-05-25,The 10th Victim,1965,https://boxd.it/1STEJf,3,,"This had a lot of just odd future tripping going on in it. Sure, you could sign up to participate in some kind of crazy blood sport that just everyone else tolerated or something. But there was also some bizarre sun worshipping cult, this very strange obsession with marriage or how it's impossible to get out of, hiding your parents or else the government will take them away, and more and more I can't even enumerate it all. Just like how robocop had a dozen different little commercials or peeks into what life was like in the near future, this was the same. Evidently, people in the near future think it's a good idea to sign up to be a hunter and prey without being a very good shot. This seems like a very bad idea.

The story itself is good enough to spruce up and reshoot. I thought the acting and everything going on was pretty good. Special effects were really not present. There's a bit of an old fashioned thread running through where two people that seem to fight a lot eventual tumble into bed and then get married at gunpoint. Other than that, it was a fun sci-fi story.",,
2021-05-25,1408,2007,https://boxd.it/1STRjf,3.5,,"I think this is a pretty awesome movie. Gave me shivers and reminds me why I like horror movies. It did go on a bit too long with the toying with the dude's emotions, but still. Pretty good.",,
2021-05-27,5 Card Stud,1968,https://boxd.it/1T6Lad,2.5,,"It's a murder mystery in a western. Bizarre love story thing going on at a ""parlor"" two-timing on the nice farmers daughter thing he got going on.

Cut out the romancing of the madame and it might have been a bit better.",,
2021-05-27,After School Massacre,2014,https://boxd.it/1T6Rol,1,,Holy hell that is bad writing. I am positive I've seen porn with better. I gave it and extra half a star because someone got killed with a mailbox and I got to watch. ,,
2021-05-28,Spider-Man: Into the Spider-Verse,2018,https://boxd.it/1TagL1,5,,"Before seeing this I hadn't ever found a comic book movie that I thought was worth watching. The stories and comics are very cheesy necessarily so because of their subject matter.

I'm saying all that because this movie is 100% great. It has a story that I found really fun and engaging, the animation is just beautiful, and I love the characters in it. So well done!",,2021-05-27
2021-05-28,The Adventures of Ford Fairlane,1990,https://boxd.it/1Tchst,1.5,,Watching this I felt like I was being included in someone's fetish fantasy without permission. How can one man be so man? This is like listening to a drunk narcissist telling you how everyone wants to be them or bang them.,,
2021-05-31,And Then There Were None,1945,https://boxd.it/1TAHUh,2.5,,"This is an ok adaptation of the book, acted well enough. There were some changes of who the characters were and what they did. The characters of the Doctor and the Butler were pretty strong characters, dramatic. What I would consider the main characters came across as rather bland, especially Lombard.

I don't think I cared for the change from the book, and unfortunately the film quality when I watched it made it tough to get through. Still, it's a good story told well, so I'm cool with saying 'meh'. ",,
2021-05-31,The Incredibles,2004,https://boxd.it/1TB0ZZ,3.5,,"It's action hero enough that my 3 year old requested it after watching it once, but it has some fun ""going through mid-life crisis without banging the babysitter' for the parents in the audience. So that's pretty cool.

I for no good reason really like the Attack of Jack-Jack short that ties into the film.",,
2021-05-31,Chopping Mall,1986,https://boxd.it/1THbJb,2,,"Oh this was pretty much nonsense. I don't remember when malls sold AR-15s but I guess that was a thing. I also was pretty tripped out when a plot plate was a cigarette machine and I had forgotten all about those. There really wasn't much chopping at all as noted in a few other reviews. 

I think it's movies like this that have delayed robots among us.",,2021-05-30
2021-06-01,Alone in the Dark,1982,https://boxd.it/1TMXyZ,3,,"This one is a bit slow and feels unfocused to me a bit. However, I think the actors portraying the crazed inmates really were quite disturbingly portrayed. Also, I love that there's a major power outage to add to the ambiance of the movie. If you're looking for a reason or motive for the killers, I couldn't find one. There seems to be a bit of commentary on society with this movie where we ask the question, who's really crazy after all? Are these escaped inmates really much worse than some of the rest of society, especially when the power is off?

Props for the scene where the inmate's under the bed, it was well done and I like how it's not tied up nice and neat at the end.",,
2021-06-02,American Gothic,1987,https://boxd.it/1TVMHf,3,,"This one is a slow burning affair. It's trying to go for a creepy atmospheric vibe. Kind of like children of the corn, but instead of killer kids it's killer adults acting like kids. With some super religion thrown in.

The overall premise, kids stumble into some isolated community of crazy people is not very original but the details are definitely different. The ending I thought was going for a Chainsaw Massacre type thing but it went a different way for sure.",,
2021-06-02,It Happened at Lakewood Manor,1977,https://boxd.it/1TWqnJ,1,,"I should probably give it only half a star, it was super dull and they're ants. You should just burn 'em with fire and lay out some bait. Maybe don't go into the hole that other people died in. Or maybe don't stand in a pile of ants like it don't mean shit. 

I haven't seen silliness like this since 'The Day After Tomorrow' when I watched people run away from cold.",,
2021-06-06,Dune,1984,https://boxd.it/1Uvh23,3,,"My dad was a big fan of the books and took me to see this movie when I was maybe 12, so I think even watching it now I have a bit of nostalgia that is bringing up the rating. This is a weird take on the story, it adds a few oddities that I'm not sure improve the story. I especially watching as an adult don't care for how Jessica is kind of sidelined compared to how strong and capable she's in the book.

The effects look a little hokey and the director seems really fascinated with flowing sand. I think it's the most coherent David Lynch film I've watched yet.",,2021-06-05
2021-06-09,1984,1956,https://boxd.it/1UTqat,3,,"This is a pretty straight forward adaptation of the book, but I felt like the romance between Winston and Julia was played up probably as was customary for the times.

The main villain is quite good, acted very well and damned wicked. I would never have fessed up to having a side piece on Big Brother to that dude. Winston was nuts.",,
2021-06-10,Angels with Dirty Faces,1938,https://boxd.it/1V0su5,4,,"James Cagney really looks strange to me, like he's got extra bumps sticking out where I'm not used to seeing them in a face. 

The movie had a decent plot, it was well acted and other than the romantic storyline kind of being just a loose end I thought it was a fairly tight bit of storytelling. Well, except for the boy's basketball game with one team not knowing the rules at all. That was just for funsies I guess.

I had great sympathy for the main character until he decided that he wanted to return to a gangster life. It seemed like he was like the guy from 'Payback' who just wanted what was owed him and everyone kept trying to kill him or cheat him and he just wants what is owed. But then he decides to leverage his information instead of just disappearing and starting over and while it's quite human and believable it was dumb.

Anyways, surprisingly good film with people doing things you'd expect real people to do made 80 some years ago. That was quite a treat.",,
2021-06-15,Ready or Not,2019,https://boxd.it/1VEhG5,5,,"I won't spoil anything. If you want a black comedy/horror adjacent type of film with a story that's pretty original watch this.

If you don't like constant f-bombs avoid.",,
2021-06-17,April Fool's Day,2008,https://boxd.it/1VRG5p,1.5,,Super bland and to me it's way too slick to be anything but a made for TV movie. Like cut it down a little bit and you've got a CSI episode or matlock or something.,,
2021-06-18,Demon Dolls,1993,https://boxd.it/1VXFr7,0.5,,"I really tried to find something redeeming about this but the acting was pretty wooden and stilted, it sounds and looks like it was filmed with a VHS camera, the story was kind of boring. I guess the sound and music did a good job of matching what was going on. That's something positive. It wasn't like it was mariachi music when the demon doll showed up.",,
2021-06-19,The Backlot Murders,2002,https://boxd.it/1W6bKh,3,,"Dude the director character in this is off the hook awesome. It's just a cheesy slasher, but if you can tolerate that as a backdrop seriously watch this dude - he steals the show.",,
2021-06-21,Black Sunday,1960,https://boxd.it/1WkGG9,1.5,,"A moody film that's kind of a period piece in a way. The opening is pretty metal, I'll give it that. But it went downhill for me after that. I think The Mummy from the 90s had a similar plot line in a way. Foolish people unlock unspeakable evil which wants revenge.",,
2021-06-21,The Ten Commandments,1923,https://boxd.it/1Wmi3h,1,,"It's just not my bag. It's silent, it's super religious, and the back half of this longer than star wars movie is just a look into ""modern"" life and application of christian belief. I bump it up half a star because it looks like huge set pieces and I can respect that. But you know those little movie clips you saw in Columbia when playing Bioshock Infinite, imagine watching those for two hours. Praise be.",,
2021-06-21,I Wake Up Screaming,1941,https://boxd.it/1WqpTn,3,,"A detective movie, I see from other reviews the ""noir"" word gets thrown around a lot. 3 guys find a lady in a diner and decide to pull a trading places routine on her without the someone falling from grace part. When she makes it, she is set to leave for hollywood and gets killed before she goes. 1 of the 3 guys is getting pegged for the murder, but he claims innocence and falls in love with the victim's sister who I guess he really didn't think about until after her sister died.

There's some pretty pushy hulk of a cop that really wants the dude to fry for it. He plays that part well. I think the lead man is lacking a bit compared to some of the other leading stars I've seen in this era but he's alright. 

I give it a slightly better than 'meh'. I don't like it when detective movies pull the real killer out of nowhere, so I dock some points for that.",,
2021-06-22,One on Top of the Other,1969,https://boxd.it/1WtlLb,3,,"This is sleezy as hell, and super 60s as well. The ""protagonist"" is also sleezy and kind of meanders his way through some pretty insensitive jackassery only to have a murder rap pinned on him and sent to be executed faster than I've ever heard of it happening in California.

In the beginning I thought the movie was just a boobtastic 60s oddity but I stuck through it and was amused by the twist and thought it was just fine as a movie overall. ",,
2021-06-26,There's Nothing Out There,1991,https://boxd.it/1X1Fof,3,,"""But what if it's a bear?""

This is some truly silly nonsense. I was amused, I'll give it that.",,
2021-06-26,Cars,2006,https://boxd.it/1X1X4d,2.5,,"My kids are obsessed with this movie, so I've seen it maybe 50 times. Mater is a cockblocker. I must not have a heart because I would have won the stupid race.",,2021-06-26
2021-06-27,Jurassic World: Fallen Kingdom,2018,https://boxd.it/1Xa6xz,2,,How many times are they going to make the same movie?,,2021-06-26
2021-06-28,Sorority House Massacre,1986,https://boxd.it/1XeYRL,1.5,,"This is different than most slashers that I've seen in that there seems to be a psychic connection between this crazy guy in an asylum and the last girl in the film. I think it's because the killer killed his family in the sorority house before it was a sorority house? Also, there's a 5 minutes dress up scene where we get most of the obligatory toplessness out of the way. I give it more than a star since they tried something different. I thought it was dumb, but it was something different.",,
2021-07-01,I Saw the Devil,2010,https://boxd.it/1XBpfj,5,,"This was an intense movie. I was really surprised at just how visually stunning some of the scenes were. The acting was top notch. I can't think of a more viscerally threatening character as the antagonist in the movie.

This is a story of revenge and what it does to someone to be consumed by vengeance. Wrath is one of the deadly sins, isn't it?  ",,
2021-07-01,Bordello of Blood,1996,https://boxd.it/1XCdlr,1.5,,"I don't think the acting would be bad for a Tales from the Crypt episode, a little cheesy but overall it doesn't even succeed at being titillating. It's mildly gross at times and surprisingly unsexy.

It's overly juvenile and just plain painful to watch. I'm very sad Prince Humperdink sunk to this level.",deleted,
2021-07-01,Tales from the Crypt: Demon Knight,1995,https://boxd.it/1XDdXd,2.5,,"This was significantly better than the follow up Bordello of Blood. Still, I thought it was a bit weak for a full length movie, although the acting in it wasn't bad and the story was fine. Still, just meh.",,
2021-07-01,Leprechaun,1993,https://boxd.it/1XDTSJ,1,,This is not a good movie. How the hell did O'Grady get the gold in the first place from this dude? This dude is murderous and seems to have fairly unlimited powers. How did a drunk old man catch this wolverine like thing with thumbs?,,
2021-07-01,Lake Consequence,1993,https://boxd.it/1XGEwp,3,,"There's probably too much naked women time and not enough hot Billy Zane time to make this movie be an equal opportunity movie, but I feel like it's closer than most I've erotic ""MILF discovers how milfy she really is"".

For what it's trying for, I give it full marks. I wish I could be as smoking cool as Zane is in this movie. But I don't really care for this kind of movie so I only go as high as 3 stars.",,
2021-07-11,The Hunger Games,2012,https://boxd.it/1Z4V1F,4,,"It's a good thing I'm not a dictator, because stealing children and putting them in an arena to fight for my amusement to the death does not seem like a great way to keep people in line. 

This movie is the best in the series. The hero had clear motives and shows grit and heart. Rue made me teary eyed. It's a little unclear what can be offered by patrons in the games but it seems pretty unfair.

Anyways, good flick, should have left it at one in my opinion.",,2021-07-10
2021-07-14,The Hunger Games: Mockingjay – Part 2,2015,https://boxd.it/1ZxGuZ,3,,"I feel like the book made it less clear who Katniss was acting as a tool for in the end, Snow or PanEm and I liked the ambiguity. Maybe I just missed something. Finick got done dirty in this film.",,2021-07-13
2021-07-27,Heat,1995,https://boxd.it/21zp2V,5,,"An epic film, it has so much packed into it and the actors are top notch amazing. If you can't watch this with surround sound, you are missing out. I'm shocked they didn't get an award for the sound, that gun battle in DT LA is just ripping through you.",,
2021-07-29,I Like to Play Games,1995,https://boxd.it/21OcPF,1.5,,"That's a lot of skin, and super 90s skin at that.

But is there a story here? No. The answer is no.",,2021-07-28
2021-07-31,Jungle Cruise,2021,https://boxd.it/227wQ7,2,,"This wasn't great. It was pretty hard to follow what was going on and when I did follow, I didn't like it. The woman in pants is the best character in the movie.",,2021-07-30
2021-08-03,The Vault,2021,https://boxd.it/22v7q7,2.5,,"I appreciate a clever heist movie. This one I couldn't for the life of me understand the way the problem they had to solve would work. How does it not kill people when you bring new things into the vault? How does it not go off when you go in to the vault and take things out appropriately? So many questions around the basic premise of this that I didn't give a crap when they overcame the obstacle I couldn't understand.

I thought it was super fun and interesting to tie it into the spanish advancing and winning the cup. That's a cute story. But the main plot of the film was pretty basic and also unapproachable by me. ",,2021-08-01
2021-08-03,Fear Street: 1994,2021,https://boxd.it/22vaNj,3.5,,"There's a lot I liked about this one. The baddies were pretty good, there was tension because just when I thought everyone was basically blessed and no lasting harm would come to anyone I got schooled. I am intrigued to watch the next one so mission accomplished movie.",,
2021-08-04,Fear Street: 1666,2021,https://boxd.it/22JwHZ,3,,"They got marginally better as they went along. There was some real evil in this one, that's for sure.
",,
2021-08-05,Daughters of Satan,1972,https://boxd.it/22OzsX,2,,It was sooooo slow. It started out pretty wacky and I thought this might be some crazy shit but then it was mostly just Tom Selleck being menaced by a dog and confused by a really bad painting.,,
2021-08-06,Werewolf of London,1935,https://boxd.it/22WpwL,2,,This one suffers because the recording I have is pretty poor quality (often looking at a very dark screen) and it's so tame and slow moving by today's standards. I do not recommend wasting the time on it. The acting is fine and the dialogue is ok too but go watch something else. Not enough tension throughout.,,
